{
  "artifact": {
    "evidence_labels": {},
    "next_action": "CONTROLLED_VALUE",
    "ranked_actions": [],
    "required_checks": [],
    "state": "CONTROLLED_VALUE"
  },
  "claim_boundary": "State only what the supplied evidence establishes.",
  "confidence": 0.0,
  "schema_version": "3.0",
  "task_id": "v07-workflow-02-architecture-advice"
}
