{
  "artifact": {
    "decision": "insufficient_current_evidence",
    "dropout_mv": 73.0,
    "evidence_used": [
      "r1",
      "r2"
    ],
    "iq_ua": 84.0,
    "record_classes": {
      "r1": "admissible_current",
      "r2": "admissible_current",
      "r3": "stale_unbound",
      "r4": "quarantine_sentinel",
      "r5": "narrative_not_measurement"
    }
  },
  "claim_boundary": "Limited to supplied evidence and named conditions.",
  "confidence": 0.95,
  "schema_version": "3.0",
  "task_id": "v07-foundation-03-unit-and-provenance"
}
